{
  "palId" : "pal/10-2017/123456789/A",
	"licensee" : "SAS_Administrator_Test",
	"userId" : "test_user_id_c",
	"registrationInformation" : {
	  "frn" : "123456-789",
	  "registrationDate": "2017-06-01"
  },
  "license": {
    "licenseId": "fccId123456789-1",
    "licenseDate": "2017-07-01T00:00:00Z",
    "licenseExpiration": "2020-07-01T00:00:00Z",
    "licenseAreaIdentifier": "Census Tract 123456789, Long Name",
    "licenseAreaExtent": "zone/census_tract/census/2010/123456789",    
    "licenseFrequencyChannelId": "1"
  },
  "licenseStatus": "VALID",
  "channelAssignment": {
    "primaryAssignment": {
      "lowFrequency": 3620000000,
      "highFrequency": 3630000000
    },    
    "secondaryAssignment": {
      "lowFrequency": 3580000000,
      "highFrequency": 3590000000    
    }  
  } 
}
